{
  "schema_version": "1.0",
  "robot_id": "franka_emika_panda",
  "model_version": "menagerie-2026.9.0-3d2262eeb81e",
  "source_artifacts": [
    {
      "repository": "https://github.com/google-deepmind/mujoco_menagerie",
      "package_version": "2026.9.0",
      "object_id": "3d2262eeb81ecec19abfa31dd509e35abbb33e67",
      "entry": "panda",
      "license": "Apache-2.0"
    }
  ],
  "links": [
    "world",
    "link0",
    "link1",
    "link2",
    "link3",
    "link4",
    "link5",
    "link6",
    "link7",
    "hand",
    "left_finger",
    "right_finger"
  ],
  "joints": [
    {
      "name": "joint1",
      "type": "hinge",
      "parent": "link0",
      "child": "link1",
      "limits": [
        -2.8973,
        2.8973
      ],
      "source": "compiled Menagerie MJCF"
    },
    {
      "name": "joint2",
      "type": "hinge",
      "parent": "link1",
      "child": "link2",
      "limits": [
        -1.7628,
        1.7628
      ],
      "source": "compiled Menagerie MJCF"
    },
    {
      "name": "joint3",
      "type": "hinge",
      "parent": "link2",
      "child": "link3",
      "limits": [
        -2.8973,
        2.8973
      ],
      "source": "compiled Menagerie MJCF"
    },
    {
      "name": "joint4",
      "type": "hinge",
      "parent": "link3",
      "child": "link4",
      "limits": [
        -3.0718,
        -0.0698
      ],
      "source": "compiled Menagerie MJCF"
    },
    {
      "name": "joint5",
      "type": "hinge",
      "parent": "link4",
      "child": "link5",
      "limits": [
        -2.8973,
        2.8973
      ],
      "source": "compiled Menagerie MJCF"
    },
    {
      "name": "joint6",
      "type": "hinge",
      "parent": "link5",
      "child": "link6",
      "limits": [
        -0.0175,
        3.7525
      ],
      "source": "compiled Menagerie MJCF"
    },
    {
      "name": "joint7",
      "type": "hinge",
      "parent": "link6",
      "child": "link7",
      "limits": [
        -2.8973,
        2.8973
      ],
      "source": "compiled Menagerie MJCF"
    },
    {
      "name": "finger_joint1",
      "type": "slide",
      "parent": "hand",
      "child": "left_finger",
      "limits": [
        0.0,
        0.04
      ],
      "source": "compiled Menagerie MJCF"
    },
    {
      "name": "finger_joint2",
      "type": "slide",
      "parent": "hand",
      "child": "right_finger",
      "limits": [
        0.0,
        0.04
      ],
      "source": "compiled Menagerie MJCF"
    }
  ],
  "end_effector_candidates": [
    {
      "body": "hand",
      "confidence": 0.95,
      "reason": "Terminal arm body and parent of the two finger branches."
    }
  ],
  "grippers": [
    {
      "type": "parallel_jaw",
      "finger_joints": [
        "finger_joint1",
        "finger_joint2"
      ],
      "actuator": "actuator8",
      "confidence": 0.95
    }
  ],
  "confirmed_facts": [
    {
      "arm_joint_count": 7,
      "finger_joint_count": 2,
      "actuator_count": 8
    }
  ],
  "inferences": [
    {
      "claim": "hand is the reach end-effector",
      "confidence": 0.95
    }
  ],
  "capabilities": [
    {
      "name": "reach",
      "status": "under_validation"
    },
    {
      "name": "parallel_grasp",
      "status": "unverified"
    }
  ],
  "discovered_behaviors": [],
  "safety_constraints": [
    {
      "type": "joint_limits",
      "source": "compiled Menagerie MJCF"
    },
    {
      "type": "simulation_only",
      "value": true
    }
  ],
  "unresolved_questions": [
    "Which hand-frame orientation constraints are required for grasping?",
    "Which collision pairs should be treated as allowed grasp contacts?"
  ]
}
